{
  "$schema": "https://json-schema.org/draft/2020-12/schema",
  "$id": "meter-reading.schema.json",
  "title": "MeterReading",
  "description": "One multimeter reading typed or spoken by the user, or read by the app from a Bluetooth meter, in response to a NextAction. The only kind of evidence that counts as proof (I1, I2). Sent into fusion. `kind` fixes the shape of `value`: voltage_dc -> {volts}; continuity -> {continuity} and pins required; resistance -> {ohms} and pins required. RepairOS's verdict (`verdict`) is judged against [min, max] in code.",
  "type": "object",
  "additionalProperties": false,
  "required": ["reading_id", "scan_id", "session_id", "kind", "net", "value", "power_state", "source", "recorded_at"],
  "properties": {
    "reading_id": { "type": "string", "minLength": 1 },
    "scan_id": { "type": "string", "minLength": 1 },
    "session_id": { "type": "string", "minLength": 1 },
    "action_id": { "type": "string", "description": "The NextAction this answers." },
    "kind": { "type": "string", "enum": ["continuity", "voltage_dc", "resistance"] },
    "net": { "type": "string", "minLength": 1, "description": "Net name from the design's electrical reference. Not a harness wire name." },
    "pins": {
      "type": "array", "items": { "type": "string", "minLength": 1 }, "minItems": 2, "maxItems": 2,
      "description": "REF.PIN ids probed, in the design's net naming (e.g. J1.1), not harness end names. Required for continuity and resistance; optional for voltage_dc ([probe +, probe -])."
    },
    "value": {
      "description": "Exactly the field that matches kind (see allOf).",
      "oneOf": [{ "$ref": "#/$defs/value_volts" }, { "$ref": "#/$defs/value_continuity" }, { "$ref": "#/$defs/value_ohms" }]
    },
    "power_state": { "type": "string", "enum": ["off", "on"] },
    "condition": { "type": "string", "enum": ["idle", "load", "charging", "unknown"], "description": "Operating condition when read. We use it to pick which part of the SPICE [min, max] applies." },
    "expected": {
      "type": "object",
      "additionalProperties": false,
      "description": "What RepairOS judged against. volts_min/volts_max come from the reference's expected {min, max}, never from a single expected value.",
      "properties": {
        "continuity": { "type": "boolean" },
        "ohms_max": { "type": "number", "minimum": 0 },
        "volts_min": { "type": "number" },
        "volts_max": { "type": "number" },
        "source": { "type": "string", "enum": ["report_json_minmax", "repairos_derived", "datasheet"] }
      }
    },
    "verdict": {
      "type": "string",
      "enum": ["agrees", "disagrees", "unknown"],
      "description": "RepairOS's verdict, computed in code against expected (inside [min - tol, max + tol], tol = 0.25 V or 5 %; under 5 ohm conducts)."
    },
    "source": { "type": "string", "enum": ["typed", "voice", "ble"], "description": "`ble`: the app read the value from the meter over Bluetooth LE; nobody typed or said it. Then `meter` says which meter and how it was set." },
    "meter": {
      "type": "object",
      "additionalProperties": false,
      "description": "The meter that produced a `ble` reading, as the app read it over Bluetooth. Absent for typed and voice readings.",
      "properties": {
        "model": { "type": "string", "description": "Model string the meter reports." },
        "firmware": { "type": "string", "description": "Firmware revision the meter reports." },
        "mode": { "type": "string", "enum": ["dc_voltage", "ac_voltage", "dc_current", "ac_current", "resistance", "diode", "continuity", "temperature"], "description": "The mode the meter was in when the value was read." },
        "range": { "type": "string", "description": "The meter's own range label, or \"auto\"." },
        "interval_ms": { "type": "integer", "minimum": 0, "description": "Update interval the app asked the meter for, in milliseconds." },
        "battery_v": { "type": "number", "description": "The meter's battery voltage when read." },
        "read_at": { "type": "string", "format": "date-time", "description": "When the app received the value from the meter." }
      }
    },
    "raw_text": { "type": "string", "description": "What the user said or typed, before parsing." },
    "recorded_at": { "type": "string", "format": "date-time" }
  },
  "allOf": [
    {
      "if": { "required": ["kind"], "properties": { "kind": { "const": "voltage_dc" } } },
      "then": { "properties": { "value": { "$ref": "#/$defs/value_volts" } } }
    },
    {
      "if": { "required": ["kind"], "properties": { "kind": { "const": "continuity" } } },
      "then": { "required": ["pins"], "properties": { "value": { "$ref": "#/$defs/value_continuity" } } }
    },
    {
      "if": { "required": ["kind"], "properties": { "kind": { "const": "resistance" } } },
      "then": { "required": ["pins"], "properties": { "value": { "$ref": "#/$defs/value_ohms" } } }
    }
  ],
  "$defs": {
    "value_volts": {
      "type": "object", "additionalProperties": false, "required": ["volts"],
      "properties": { "volts": { "type": "number" } }
    },
    "value_continuity": {
      "type": "object", "additionalProperties": false, "required": ["continuity"],
      "properties": { "continuity": { "type": "boolean", "description": "True when the meter beeps / reads under 5 ohm." } }
    },
    "value_ohms": {
      "type": "object", "additionalProperties": false, "required": ["ohms"],
      "properties": { "ohms": { "type": "number", "minimum": 0 } }
    }
  }
}
